{
  "anchor_index": 1,
  "anchor_selector": "jsx:h2",
  "anchor_text": "How heating and cooling systems work",
  "insertion_mode": "INLINE",
  "market": {
    "country": "",
    "locale": ""
  },
  "page_path": "app/heating-cooling-explained/page.tsx",
  "priority_level": 3,
  "prompt": "Photorealistic scene in a real environment, grounded in the topic:\nHow heating and cooling systems work | how-heating-and-cooling-systems-work | app/heating-cooling-explained/page.tsx\n\nComposition and realism rules:\n- Natural lighting, realistic perspective, and credible materials.\n- No text or typography in the scene.\n- No screens, UI, logos, or branding.\n- No ad-like or misleading button visuals.\n- Avoid centered symmetry; use organic framing.\n- Avoid repeated compositions across slots.\n\nCamera:\n- 35mm lens equivalent, shallow-to-moderate depth of field.\n- Horizontal framing unless the slot is explicitly vertical.\n",
  "prompt_hash": "81ee7cf70e77050894f1ba26e4690cae74ca3ebe2023e29008163c0be66d1031",
  "prompt_version": "v1",
  "risk_factors": [],
  "risk_score": 0.0,
  "slot_id": "032cabbf4b2b96728e920091",
  "slot_key": "how-heating-and-cooling-systems-work"
}