{
  "anchor_index": 0,
  "anchor_selector": "jsx:h1",
  "anchor_text": "Blog",
  "insertion_mode": "HERO",
  "market": {
    "country": "",
    "locale": ""
  },
  "page_path": "app/blog/page/[page]/page.tsx",
  "priority_level": 5,
  "prompt": "Photorealistic scene in a real environment, grounded in the topic:\nBlog | hero | app/blog/page/[page]/page.tsx\n\nComposition and realism rules:\n- Natural lighting, realistic perspective, and credible materials.\n- No text or typography in the scene.\n- No screens, UI, logos, or branding.\n- No ad-like or misleading button visuals.\n- Avoid centered symmetry; use organic framing.\n- Avoid repeated compositions across slots.\n\nCamera:\n- 35mm lens equivalent, shallow-to-moderate depth of field.\n- Horizontal framing unless the slot is explicitly vertical.\n",
  "prompt_hash": "3d16ce476f6ffdb3e1d8ce0e9ed83ae1180f3cd2231e4af86f945d72cb0c5f89",
  "prompt_version": "v1",
  "risk_factors": [],
  "risk_score": 0.0,
  "slot_id": "5ace06f076805659dc8872b7",
  "slot_key": "hero"
}