{
  "anchor_index": 1,
  "anchor_selector": "jsx:h2",
  "anchor_text": "What is natural gas and how does it reach your home?",
  "insertion_mode": "INLINE",
  "market": {
    "country": "",
    "locale": ""
  },
  "page_path": "app/gas-explained/page.tsx",
  "priority_level": 3,
  "prompt": "Photorealistic scene in a real environment, grounded in the topic:\nWhat is natural gas and how does it reach your home? | what-is-natural-gas-and-how-does-it-reach-your-home | app/gas-explained/page.tsx\n\nComposition and realism rules:\n- Natural lighting, realistic perspective, and credible materials.\n- No text or typography in the scene.\n- No screens, UI, logos, or branding.\n- No ad-like or misleading button visuals.\n- Avoid centered symmetry; use organic framing.\n- Avoid repeated compositions across slots.\n\nCamera:\n- 35mm lens equivalent, shallow-to-moderate depth of field.\n- Horizontal framing unless the slot is explicitly vertical.\n",
  "prompt_hash": "1448dba9d5203fcf46b442ffac814e6054aced63b9694da3d2929a3cf3e7b486",
  "prompt_version": "v1",
  "risk_factors": [],
  "risk_score": 0.0,
  "slot_id": "249dadbf0a0f03420fc66fb1",
  "slot_key": "what-is-natural-gas-and-how-does-it-reach-your-home"
}