{
  "anchor_index": 0,
  "anchor_selector": "jsx:h1",
  "anchor_text": "Frequently asked questions",
  "insertion_mode": "HERO",
  "market": {
    "country": "",
    "locale": ""
  },
  "page_path": "app/blog/[slug]/page.tsx",
  "priority_level": 5,
  "prompt": "Photorealistic scene in a real environment, grounded in the topic:\nFrequently asked questions | hero | app/blog/[slug]/page.tsx\n\nComposition and realism rules:\n- Natural lighting, realistic perspective, and credible materials.\n- No text or typography in the scene.\n- No screens, UI, logos, or branding.\n- No ad-like or misleading button visuals.\n- Avoid centered symmetry; use organic framing.\n- Avoid repeated compositions across slots.\n\nCamera:\n- 35mm lens equivalent, shallow-to-moderate depth of field.\n- Horizontal framing unless the slot is explicitly vertical.\n",
  "prompt_hash": "c3add328d3177ad24d901f134b77231f3e7c47f33dab00e98c6b3a4393ad95df",
  "prompt_version": "v1",
  "risk_factors": [],
  "risk_score": 0.0,
  "slot_id": "e1d1588004c984b540b8c22c",
  "slot_key": "hero"
}