{
  "anchor_index": 6,
  "anchor_selector": "jsx:h2",
  "anchor_text": "Taxes and surcharges",
  "insertion_mode": "INLINE",
  "market": {
    "country": "",
    "locale": ""
  },
  "page_path": "app/utility-bills-costs-explained/page.tsx",
  "priority_level": 3,
  "prompt": "Photorealistic scene in a real environment, grounded in the topic:\nTaxes and surcharges | taxes-and-surcharges | app/utility-bills-costs-explained/page.tsx\n\nComposition and realism rules:\n- Natural lighting, realistic perspective, and credible materials.\n- No text or typography in the scene.\n- No screens, UI, logos, or branding.\n- No ad-like or misleading button visuals.\n- Avoid centered symmetry; use organic framing.\n- Avoid repeated compositions across slots.\n\nCamera:\n- 35mm lens equivalent, shallow-to-moderate depth of field.\n- Horizontal framing unless the slot is explicitly vertical.\n",
  "prompt_hash": "4f21dfebfe05fc6ca346de5d4d0b9b47f51231ac2a832c871266a6ac78dfa1a2",
  "prompt_version": "v1",
  "risk_factors": [],
  "risk_score": 0.0,
  "slot_id": "e7c8bc7e4ca18e4604f8a047",
  "slot_key": "taxes-and-surcharges"
}