{
  "anchor_index": 0,
  "anchor_selector": "jsx:h1",
  "anchor_text": "Natural Gas Explained: Your Complete Guide",
  "insertion_mode": "HERO",
  "market": {
    "country": "",
    "locale": ""
  },
  "page_path": "app/gas-explained/page.tsx",
  "priority_level": 5,
  "prompt": "Photorealistic scene in a real environment, grounded in the topic:\nNatural Gas Explained: Your Complete Guide | hero | app/gas-explained/page.tsx\n\nComposition and realism rules:\n- Natural lighting, realistic perspective, and credible materials.\n- No text or typography in the scene.\n- No screens, UI, logos, or branding.\n- No ad-like or misleading button visuals.\n- Avoid centered symmetry; use organic framing.\n- Avoid repeated compositions across slots.\n\nCamera:\n- 35mm lens equivalent, shallow-to-moderate depth of field.\n- Horizontal framing unless the slot is explicitly vertical.\n",
  "prompt_hash": "196802f2dc00af3cb89b5c9d02beea2ba540e7dbaa5dba3ac333160c553a7ce2",
  "prompt_version": "v1",
  "risk_factors": [],
  "risk_score": 0.0,
  "slot_id": "4b3dbc8b048eb6e59ae062b9",
  "slot_key": "hero"
}