{
  "anchor_index": 4,
  "anchor_selector": "jsx:h2",
  "anchor_text": "Energy charge (supply charge)",
  "insertion_mode": "INLINE",
  "market": {
    "country": "",
    "locale": ""
  },
  "page_path": "app/electricity-explained/page.tsx",
  "priority_level": 3,
  "prompt": "Photorealistic scene in a real environment, grounded in the topic:\nEnergy charge (supply charge) | energy-charge-supply-charge | app/electricity-explained/page.tsx\n\nComposition and realism rules:\n- Natural lighting, realistic perspective, and credible materials.\n- No text or typography in the scene.\n- No screens, UI, logos, or branding.\n- No ad-like or misleading button visuals.\n- Avoid centered symmetry; use organic framing.\n- Avoid repeated compositions across slots.\n\nCamera:\n- 35mm lens equivalent, shallow-to-moderate depth of field.\n- Horizontal framing unless the slot is explicitly vertical.\n",
  "prompt_hash": "f61251a415d7faae52c5de87eb03049cbed346592d57203fb3857566f6616e7c",
  "prompt_version": "v1",
  "risk_factors": [],
  "risk_score": 0.0,
  "slot_id": "796b5267e17f6e655e871b95",
  "slot_key": "energy-charge-supply-charge"
}