{
  "anchor_index": 3,
  "anchor_selector": "jsx:h2",
  "anchor_text": "Amps (Amperes)",
  "insertion_mode": "INLINE",
  "market": {
    "country": "",
    "locale": ""
  },
  "page_path": "app/utilities-glossary/page.tsx",
  "priority_level": 3,
  "prompt": "Photorealistic scene in a real environment, grounded in the topic:\nAmps (Amperes) | amps-amperes | app/utilities-glossary/page.tsx\n\nComposition and realism rules:\n- Natural lighting, realistic perspective, and credible materials.\n- No text or typography in the scene.\n- No screens, UI, logos, or branding.\n- No ad-like or misleading button visuals.\n- Avoid centered symmetry; use organic framing.\n- Avoid repeated compositions across slots.\n\nCamera:\n- 35mm lens equivalent, shallow-to-moderate depth of field.\n- Horizontal framing unless the slot is explicitly vertical.\n",
  "prompt_hash": "0c67f884be41dfad6b3960d5094f44478c48e6dfe82c8fbc84e19dc636247209",
  "prompt_version": "v1",
  "risk_factors": [],
  "risk_score": 0.0,
  "slot_id": "11341d4cc665a970f6f245ab",
  "slot_key": "amps-amperes"
}