{
  "anchor_index": 3,
  "anchor_selector": "jsx:h2",
  "anchor_text": "Gas furnaces",
  "insertion_mode": "INLINE",
  "market": {
    "country": "",
    "locale": ""
  },
  "page_path": "app/heating-cooling-explained/page.tsx",
  "priority_level": 3,
  "prompt": "Photorealistic scene in a real environment, grounded in the topic:\nGas furnaces | gas-furnaces | app/heating-cooling-explained/page.tsx\n\nComposition and realism rules:\n- Natural lighting, realistic perspective, and credible materials.\n- No text or typography in the scene.\n- No screens, UI, logos, or branding.\n- No ad-like or misleading button visuals.\n- Avoid centered symmetry; use organic framing.\n- Avoid repeated compositions across slots.\n\nCamera:\n- 35mm lens equivalent, shallow-to-moderate depth of field.\n- Horizontal framing unless the slot is explicitly vertical.\n",
  "prompt_hash": "75b78b5b3effbce79432109fac8bade8a79d811c6bafc9da795317c5ad3287c1",
  "prompt_version": "v1",
  "risk_factors": [],
  "risk_score": 0.0,
  "slot_id": "41c49ce4cbe5b37e7a6c8cb9",
  "slot_key": "gas-furnaces"
}