{
  "anchor_index": 5,
  "anchor_selector": "jsx:h2",
  "anchor_text": "Delivery charge (distribution charge)",
  "insertion_mode": "INLINE",
  "market": {
    "country": "",
    "locale": ""
  },
  "page_path": "app/electricity-explained/page.tsx",
  "priority_level": 3,
  "prompt": "Photorealistic scene in a real environment, grounded in the topic:\nDelivery charge (distribution charge) | delivery-charge-distribution-charge | app/electricity-explained/page.tsx\n\nComposition and realism rules:\n- Natural lighting, realistic perspective, and credible materials.\n- No text or typography in the scene.\n- No screens, UI, logos, or branding.\n- No ad-like or misleading button visuals.\n- Avoid centered symmetry; use organic framing.\n- Avoid repeated compositions across slots.\n\nCamera:\n- 35mm lens equivalent, shallow-to-moderate depth of field.\n- Horizontal framing unless the slot is explicitly vertical.\n",
  "prompt_hash": "cdf68d8ba6d642c00564a1a0f01b6d71a9705b3abf880c3f0da8aff48e052723",
  "prompt_version": "v1",
  "risk_factors": [],
  "risk_score": 0.0,
  "slot_id": "01a8e8e113c3baa2c365dea7",
  "slot_key": "delivery-charge-distribution-charge"
}