{
  "anchor_index": 1,
  "anchor_selector": "jsx:h2",
  "anchor_text": "What is electricity and how does it reach your home?",
  "insertion_mode": "INLINE",
  "market": {
    "country": "",
    "locale": ""
  },
  "page_path": "app/electricity-explained/page.tsx",
  "priority_level": 3,
  "prompt": "Photorealistic scene in a real environment, grounded in the topic:\nWhat is electricity and how does it reach your home? | what-is-electricity-and-how-does-it-reach-your-home | app/electricity-explained/page.tsx\n\nComposition and realism rules:\n- Natural lighting, realistic perspective, and credible materials.\n- No text or typography in the scene.\n- No screens, UI, logos, or branding.\n- No ad-like or misleading button visuals.\n- Avoid centered symmetry; use organic framing.\n- Avoid repeated compositions across slots.\n\nCamera:\n- 35mm lens equivalent, shallow-to-moderate depth of field.\n- Horizontal framing unless the slot is explicitly vertical.\n",
  "prompt_hash": "3be89d00113f7ff419b248b803e63a00279e65d9b14c08b5321395d34ba35eac",
  "prompt_version": "v1",
  "risk_factors": [],
  "risk_score": 0.0,
  "slot_id": "fcd5226f3e6c4dd2354777a1",
  "slot_key": "what-is-electricity-and-how-does-it-reach-your-home"
}