{
  "anchor_index": 0,
  "anchor_selector": "jsx:h1",
  "anchor_text": "Electricity Explained: Your Complete Guide",
  "insertion_mode": "HERO",
  "market": {
    "country": "",
    "locale": ""
  },
  "page_path": "app/electricity-explained/page.tsx",
  "priority_level": 5,
  "prompt": "Photorealistic scene in a real environment, grounded in the topic:\nElectricity Explained: Your Complete Guide | hero | app/electricity-explained/page.tsx\n\nComposition and realism rules:\n- Natural lighting, realistic perspective, and credible materials.\n- No text or typography in the scene.\n- No screens, UI, logos, or branding.\n- No ad-like or misleading button visuals.\n- Avoid centered symmetry; use organic framing.\n- Avoid repeated compositions across slots.\n\nCamera:\n- 35mm lens equivalent, shallow-to-moderate depth of field.\n- Horizontal framing unless the slot is explicitly vertical.\n",
  "prompt_hash": "6a1bc5be4eedafdb551ab8919013b3d55143483ab1448b33eda7aa9f10daee95",
  "prompt_version": "v1",
  "risk_factors": [],
  "risk_score": 0.0,
  "slot_id": "c4b7cdc06ad74fbf2d969102",
  "slot_key": "hero"
}