{
  "anchor_index": 3,
  "anchor_selector": "jsx:h2",
  "anchor_text": "Understanding your water bill",
  "insertion_mode": "INLINE",
  "market": {
    "country": "",
    "locale": ""
  },
  "page_path": "app/water-explained/page.tsx",
  "priority_level": 3,
  "prompt": "Photorealistic scene in a real environment, grounded in the topic:\nUnderstanding your water bill | understanding-your-water-bill | app/water-explained/page.tsx\n\nComposition and realism rules:\n- Natural lighting, realistic perspective, and credible materials.\n- No text or typography in the scene.\n- No screens, UI, logos, or branding.\n- No ad-like or misleading button visuals.\n- Avoid centered symmetry; use organic framing.\n- Avoid repeated compositions across slots.\n\nCamera:\n- 35mm lens equivalent, shallow-to-moderate depth of field.\n- Horizontal framing unless the slot is explicitly vertical.\n",
  "prompt_hash": "6624ceb46dba61cd22f13dae247c6a1945cb82073ff30d200627886b3feed449",
  "prompt_version": "v1",
  "risk_factors": [],
  "risk_score": 0.0,
  "slot_id": "c59916529dd9ddb1c1221742",
  "slot_key": "understanding-your-water-bill"
}