{
  "anchor_index": 6,
  "anchor_selector": "jsx:h2",
  "anchor_text": "Fixed fees and other charges",
  "insertion_mode": "INLINE",
  "market": {
    "country": "",
    "locale": ""
  },
  "page_path": "app/electricity-explained/page.tsx",
  "priority_level": 3,
  "prompt": "Photorealistic scene in a real environment, grounded in the topic:\nFixed fees and other charges | fixed-fees-and-other-charges | app/electricity-explained/page.tsx\n\nComposition and realism rules:\n- Natural lighting, realistic perspective, and credible materials.\n- No text or typography in the scene.\n- No screens, UI, logos, or branding.\n- No ad-like or misleading button visuals.\n- Avoid centered symmetry; use organic framing.\n- Avoid repeated compositions across slots.\n\nCamera:\n- 35mm lens equivalent, shallow-to-moderate depth of field.\n- Horizontal framing unless the slot is explicitly vertical.\n",
  "prompt_hash": "33b06636bf7a7ecd911cc2da48cb613d22c6ad747675a2de7ab9ec36b3117a1f",
  "prompt_version": "v1",
  "risk_factors": [],
  "risk_score": 0.0,
  "slot_id": "7b628291d6766baad6cdb446",
  "slot_key": "fixed-fees-and-other-charges"
}